<?xml version="1.0" encoding="UTF-8"?>
<rlplan xmlns:xsi="http://www.w3.org/2001/XMLSchema-instance" xsi:noNamespaceSchemaLocation="rlplan.xsd">
	<rrtConCon>
		<duration>1200</duration>
		<goal>
			<q unit="deg">-25</q>
			<q unit="deg">90</q>
			<q unit="deg">0</q>
			<q unit="deg">0</q>
			<q unit="deg">0</q>
			<q unit="deg">0</q>
		</goal>
		<model>
			<kinematics href="../rlkin/staeubli-tx60l.xml">
				<world>
					<rotation>
						<x>0</x>
						<y>0</y>
						<z>0</z>
					</rotation>
					<translation>
						<x>-0.625</x>
						<y>0</y>
						<z>0</z>
					</translation>
				</world>
			</kinematics>
			<model>0</model>
			<scene href="../rlsg/staeubli-tx60l_wall.convex.xml"/>
		</model>
		<start>
			<q unit="deg">20</q>
			<q unit="deg">90</q>
			<q unit="deg">0</q>
			<q unit="deg">0</q>
			<q unit="deg">0</q>
			<q unit="deg">0</q>
		</start>
		<viewer>
			<background>
				<r>0</r>
				<g>0</g>
				<b>0</b>
			</background>
			<camera>
				<position>
					<x>-1.25</x>
					<y>-1.25</y>
					<z>2.5</z>
				</position>
				<scale>1</scale>
				<target>
					<x>0</x>
					<y>0</y>
					<z>0.25</z>
				</target>
				<up>
					<x>0</x>
					<y>0</y>
					<z>1</z>
				</up>
			</camera>
			<delta unit="deg">1</delta>
			<model>
				<kinematics href="../rlkin/staeubli-tx60l.xml">
					<world>
						<rotation>
							<x>0</x>
							<y>0</y>
							<z>0</z>
						</rotation>
						<translation>
							<x>-0.625</x>
							<y>0</y>
							<z>0</z>
						</translation>
					</world>
				</kinematics>
				<model>0</model>
				<scene href="../rlsg/staeubli-tx60l_wall.xml"/>
			</model>
			<size>
				<height>768</height>
				<width>1024</width>
			</size>
			<wait/>
		</viewer>
		<delta unit="deg">1</delta>
		<uniformSampler/>
	</rrtConCon>
</rlplan>
